{
  "id": "ctx_35168070461f2cf86ad5282857294e18",
  "schemaVersion": "0.1",
  "name": "SairiOS development",
  "type": "persistent",
  "status": "active",
  "createdAt": "2026-07-28T09:00:00.000Z",
  "updatedAt": "2026-07-28T11:00:00.000Z",
  "objective": "Build and maintain SairiOS: the context runtime, the shell and the Linux image.",
  "memory": [
    {
      "key": "architecture-principle",
      "value": "Every window is a context.",
      "scope": "durable",
      "sensitive": false,
      "updatedAt": "2026-07-28T09:10:00.000Z"
    },
    {
      "key": "ui-invariant",
      "value": "The model never returns executable frontend code.",
      "scope": "durable",
      "sensitive": false,
      "updatedAt": "2026-07-28T09:10:00.000Z"
    }
  ],
  "artifacts": [],
  "permissions": [
    {
      "capability": "process.list",
      "decision": "allow",
      "scope": "context",
      "remembered": false,
      "grantedAt": "2026-07-28T10:00:00.000Z",
      "grantedBy": "default-policy"
    }
  ],
  "tasks": [
    {
      "id": "tsk_dbc8d8acfa524f2537427d5d0c9d2a5f",
      "title": "Boot the VM image end to end",
      "status": "pending",
      "createdAt": "2026-07-28T09:20:00.000Z",
      "updatedAt": "2026-07-28T09:20:00.000Z"
    },
    {
      "id": "tsk_dec8dd6550dfc638a00be041f72b28d3",
      "title": "Connect the OpenClaw gateway",
      "status": "pending",
      "createdAt": "2026-07-28T09:21:00.000Z",
      "updatedAt": "2026-07-28T09:21:00.000Z"
    },
    {
      "id": "tsk_ddc8dbd2d6cb90a39b876c650ab3507b",
      "title": "Write the context lifecycle tests",
      "status": "done",
      "createdAt": "2026-07-28T09:22:00.000Z",
      "updatedAt": "2026-07-28T10:30:00.000Z"
    }
  ],
  "events": [
    {
      "id": "evt_579ebad9948dfb8acb18f02f869e5d2d",
      "kind": "context.created",
      "at": "2026-07-28T09:00:00.000Z",
      "summary": "Context created as persistent"
    },
    {
      "id": "evt_549eb620f6f3077360f2202f0b83befd",
      "kind": "intention.submitted",
      "at": "2026-07-28T09:02:00.000Z",
      "summary": "SairiOS development"
    },
    {
      "id": "evt_559eb7b371073d081c1ad2b7f7fb9755",
      "kind": "ui.specification-updated",
      "at": "2026-07-28T09:03:00.000Z",
      "summary": "Interface updated (6 regions)"
    },
    {
      "id": "evt_5a9ebf9202ca9c495e1046574c05e635",
      "kind": "action.executed",
      "at": "2026-07-28T10:00:00.000Z",
      "summary": "Listed SairiOS services"
    },
    {
      "id": "evt_5b9ec1257cded1deb0541df7387dbe8d",
      "kind": "agent.message",
      "at": "2026-07-28T10:15:00.000Z",
      "summary": "Summarized milestone 0 status"
    }
  ],
  "uiSpecification": {
    "version": "0.1",
    "contextId": "ctx_35168070461f2cf86ad5282857294e18",
    "title": "SairiOS development",
    "contextType": "persistent",
    "layout": {
      "type": "workspace",
      "regions": [
        {
          "id": "status",
          "width": "one-third",
          "component": {
            "type": "status-panel",
            "binding": "project.status",
            "props": {
              "title": "Milestone 0",
              "items": [
                {
                  "label": "Context domain model",
                  "state": "ok",
                  "detail": "Schema, lifecycle, crystallization"
                },
                {
                  "label": "SairiUI protocol",
                  "state": "ok",
                  "detail": "16-component catalog, validated"
                },
                {
                  "label": "Permission broker",
                  "state": "ok",
                  "detail": "Observe / propose / execute"
                },
                {
                  "label": "Desktop shell",
                  "state": "ok",
                  "detail": "React, mock mode"
                },
                {
                  "label": "OpenClaw provider",
                  "state": "pending",
                  "detail": "Scaffolded, not connected"
                },
                {
                  "label": "VM image",
                  "state": "warn",
                  "detail": "Scripts written, never booted"
                }
              ]
            }
          }
        },
        {
          "id": "tasks",
          "width": "one-third",
          "component": {
            "type": "checklist",
            "binding": "project.tasks",
            "props": {
              "title": "Next up",
              "items": [
                {
                  "id": "boot",
                  "label": "Boot the VM image end to end",
                  "checked": false
                },
                {
                  "id": "openclaw",
                  "label": "Connect the OpenClaw gateway",
                  "checked": false
                },
                {
                  "id": "tauri",
                  "label": "Evaluate the Tauri packaging path",
                  "checked": false
                },
                {
                  "id": "sync",
                  "label": "Prototype context sync between two devices",
                  "checked": false
                }
              ]
            }
          }
        },
        {
          "id": "metadata",
          "width": "one-third",
          "component": {
            "type": "context-metadata",
            "props": {
              "title": "This context",
              "showObjective": true
            }
          }
        },
        {
          "id": "decisions",
          "width": "one-half",
          "component": {
            "type": "key-value-list",
            "binding": "project.decisions",
            "props": {
              "title": "Decisions on record",
              "items": [
                {
                  "key": "ADR-0001",
                  "value": "Debian 12 base image, not a kernel fork"
                },
                {
                  "key": "ADR-0003",
                  "value": "Declarative SairiUI; the model never returns code"
                },
                {
                  "key": "ADR-0004",
                  "value": "OpenClaw stays behind the agent bridge"
                },
                {
                  "key": "ADR-0006",
                  "value": "Every privileged action goes through the broker"
                }
              ]
            }
          }
        },
        {
          "id": "files",
          "width": "one-half",
          "component": {
            "type": "file-list",
            "binding": "project.files",
            "props": {
              "title": "Recent files",
              "files": [
                {
                  "name": "ARCHITECTURE.md",
                  "relativePath": "notes/ARCHITECTURE.md",
                  "byteSize": 14820,
                  "mediaType": "text/markdown"
                },
                {
                  "name": "sairi-ui.schema.json",
                  "relativePath": "notes/sairi-ui.schema.json",
                  "byteSize": 11402,
                  "mediaType": "application/json"
                },
                {
                  "name": "milestone-0.md",
                  "relativePath": "notes/milestone-0.md",
                  "byteSize": 3118,
                  "mediaType": "text/markdown"
                }
              ]
            }
          }
        },
        {
          "id": "activity",
          "width": "full",
          "component": {
            "type": "activity-log",
            "props": {
              "title": "Activity",
              "limit": 12
            }
          }
        }
      ]
    },
    "suggestedActions": [
      {
        "id": "list.services",
        "label": "Check running services",
        "kind": "system",
        "capability": "process.list"
      },
      {
        "id": "read.notes",
        "label": "Read milestone notes",
        "kind": "system",
        "capability": "files.read"
      }
    ]
  },
  "agentSession": {
    "provider": "mock",
    "sessionId": null,
    "status": "idle"
  },
  "parentContextId": null,
  "crystallizedFrom": null
}
